hltb_id,title,rating,retirement,platform,genre,date,time,price,memoire_vive,espace_disque,pourcentage_pos,review_count,rating_value,best_rating,worst_rating,description,langues_audio,langues_sous_titres,twenty_four_hours,all_time
125,A Farewell to Dragons,20,13.3,['PC'],"['Role-Playing', 'Adventure']",2009,<NA>,<NA>,<NA>,<NA>,<NA>,<NA>,<NA>,<NA>,<NA>,<NA>,<NA>,<NA>,0,4
127,A Game of Dwarves,65,14.1,['PC'],"['City-Building', 'Strategy']",2012,35.0,$9.99,<NA>,<NA>,64 ,353,6,10,1,"		A Dwarven Prince on a quest to reclaim his people’s stolen land will take you on a great journey. Explore a continent filled with buried treasures and unearth mysteries that have laid hidden since the Great War. Take charge of your Dwarven settlement while mining, exploring and utilizing your resources with a combination of strategy and management.Order the inhabitants of a Dwarven settlement to dig, build and conduct research in order to strengthen the clan. Be careful though because you must defend your Dwarves from the terrible beasts that lie in the depths. A unique world is generated each time a new level starts, so you will need to dynamically adapt your strategies and tactics during each session.As you advance, the Dwarves will level up and gain new skills; progressing from weak dwarvlings to near immortal warriors or master craftsmen. There are also rare resources to be found deeper in the earth that grant access to better buildings and equipment. However, the deeper you dig the more dangerous foes you might unleash…Key Features:Explore – The randomly generated maps offer replayability while also providing a sense of explorationBuild – customize your settlement with not only practical constructions, but beautiful ones too! Build objects you think look great, while still gaining progress. Home is where the art is.Command – With an intuitive order system the player can easily control oodles of dwarves simultaneously without the need for extensive micro managementA 13 level, story driven campaignCustom game mode: Create a world without enemies so you can build uninterrupted or spawn lots of them to increase the challenge ",<NA>,[],3,1623
128,A Game of Thrones: Genesis,48, 19.4,['PC'],['Strategy'],2011,10.4,$9.99,<NA>,<NA>,34 ,394,5,10,1,"		Quel roi serez-vous ?Conquérant, usurpateur ou diplomate ? ""A Game of Thrones - Genesis"" vous plonge au cœur des batailles et des intrigues entre les grandes Maisons qui ont façonné le royaume de Westeros. Depuis l’arrivée de Nyméria sur les terres du royaume de Dorne, jusqu’au réveil des « Autres » au-delà du Mur, c’est toute la genèse de la grande saga du Trône de Fer que vous vivrez à travers plus de 1000 ans d’Histoire en devenant acteur des batailles et des événements fondateurs de WesterosDans ce grand jeu mêlant stratégie, diplomatie et politique, victoire ne rime pas nécessairement avec force. Vous pouvez opter pour une approche militaire et assiéger vos adversaires, les étouffer dans une guerre économique, ou encore faire usage de ruse et de diplomatie pour les écraser politiquement ! Traîtrise et fourberie sont de la partie et peuvent s’avérer plus renversantes que la plus puissante des armées. Surveillez vos arrières et apprêtez-vous à livrer une lutte sans merci pour prendre place sur le Trône de Fer. Caractéristiques :Ce jeu est l'adaptation de la saga fantastique ""A Song of Ice and Fire"" de George RR Martin.Une profondeur de jeu incroyable : un gameplay passionnant mêlant stratégie, diplomatie et politique. Découvrez la genèse de l’univers du Trône de Fer à travers le mode Histoire, et participez aux plus grands conflits qui ont façonné Westeros.Affrontez jusqu’à 7 autres joueurs en multijoueur. Formez des alliances et rompez-les, faites preuve de subtilité tactique et écrasez vos adversaires ! ",[],[],<NA>,<NA>
130,A Hat in Time,82,3.4,"['Mac', 'Nintendo Switch', 'PC', 'PlayStation 4', 'Xbox One']","['Third-Person', 'Action', 'Adventure', 'Platform']",2017,9.833333333333334,$29.95,<NA>,<NA>,95 ,39178,10,10,1,"jeu
A Hat in Time est un jeu de plateformes super-choupi où une petite fille doit tricoter ses propres chapeaux tous dotés de pouvoirs totalement déments !Une petite fille et son vaisseauA Hat in Time te met dans les chaussures d'une jeune voyageuse de l'espace coiffée d'un haut-de-forme. Son aventure se trouve brusquement interrompue car le carburant de son vaisseau, les Fragments Temporels, se sont écrasés sur une planète voisine. Elle doit maintenant utiliser son vaste arsenal de mouvements et de chapeaux afin d'explorer ce monde inconnu dans ses moindres recoins pour pouvoir reprendre son voyage. Sur sa route, elle croisera de nombreux personnages, tel que la Mafia des Cuistots, les oiseaux des Studios Dead Bird,  les menaçants autochtones de la Forêt Onirique, et plus encore !Enquêter dans un train ! Des parades ! S'infiltrer dans un studio de cinéma ?Chaque mission de A Hat in Time est unique ! Entre résoudre Le Meurtre de l'Owl Express, mener La Grande Parade, et devoir vous infiltrer dans les Studios Dead Bird, vous ne saurez plus sur quel pied danser !Une petite fille dans un vaste mondeBondissez librement dans 5 mondes gigantesques, où l'aventure vous attend à chaque virage ! Comme n'importe quel enfant, cette petite fille adore courir de partout, aucune montagne n'est insurmontable pour elle.  Sa vaste panoplie de sauts lui permet d'aller où bon lui semble !Pelotes magiques, badges et autres chapeaux mignonsEn trouvant les pelotes cachées dans les mondes, de nouveaux chapeaux, tous avec leur propres pouvoirs vous deviendront accessible, la coiffe  de alchimiste vous permettra de jeter des concoctions explosives, un masque à l'allure flippante vous permettre de jeter un bref coup œil  dans une autre dimension. Les chapeaux peuvent même être améliorés, en achetant des badges aux habitants de chaque monde !Le communautaire mis en avantA Hat in Time a été rendu possible par Kickstarter, atteignant près de 10 fois sa somme initiale ! Pour célébrer cela, il est désormais possible de modder A Hat in Time, qui a son propre Steam Workshop, mais aussi de prendre ses propres photos, et plus encore !						",<NA>,<NA>,205,7272
134,A New Beginning,67,4.5,['PC'],"['Point-and-Click', 'Adventure']",2011,9.966666666666667,$9.99,<NA>,<NA>,74 ,1340,7,10,1,"		A New Beginning est un thriller d’aventure cinématographique réalisé dans le style d’un roman visuel. Dans cette aventure charmante et pleine d’esprit, la Terre est sur le point de subir une catastrophe climatique. Vous devez faire le tour du monde pour épargner le genre humain et sauver l’humanité de ce destin terrible.Le bio-ingénieur Bent Svensson a été forcé d’arrêter ses recherches sur les sources d’énergie alternatives. Cet ancien travailleur acharné vit maintenant en reclus dans les forêts isolées de la Norvège. Sa paisible retraite anticipée est gâchée par Fay, une jeune femme qui prétend venir du futur. Elle essaye de le convaincre qu’elle est venue pour empêcher cette catastrophe climatique de se produire et que d’après elle, les recherches de Bent constituent ses dernières chances d’y parvenir.Cependant, ses résultats sont sur le point de tomber dans les mains d’un géant de l’énergie sans conscience intéressé uniquement par les bénéfices de ses investissements.Ensemble, Bent et Fay doivent maintenant mettre fin à cette catastrophe planétaire imminente.Caractéristiques Un thriller d’aventure de toute puissance, basé sur le problème contemporain du réchauffement mondial Plus de 100 arrière-plans époustouflants et très détaillés Plus de 20 heures de temps de jeu Style de roman graphique exclusif avec une heure de scènes de dessin animé coupées Un chef-d’œuvre, écrit par les créateurs de « The Whispered World », « The Dark Eye: Chains of Satinav », « Harvey's New Eyes » et de la trilogie Deponia ",<NA>,<NA>,4,173
138,A Stroke of Fate: Operation Valkyrie,55,8.4,['PC'],"['Point-and-Click', 'Adventure']",2009,9.0,$6.99,<NA>,<NA>,68 ,25,6,10,1,"jeu
L'opération Valkyrie est un épisode célèbre de la résistance allemande dont le but est de renverser le tyrannique gouvernement Nazi. Standartenfuhrer Gerhard Mayer, un patriote qui travaille au Département Central pour la Sécurité du Reich apprend que la Gestapo a localisé les conspirateurs. Il fait tout son possible pour que l'enquête lui soit confiée et tente de brouiller les pistes de la Gestapo afin d'aider la Résistance à renverser le régime Nazi et mettre fin à la guerre.
Caractéristiques principales :

Jeu d'aventure et d'enquête sur fond de trame historique.
Graphismes photoréalistes haute-résolution.
Immersion totale dans une atmosphère historique, avec possibilité d'afficher les graphismes en noir et blanc dans le style des vidéos d'époque.
Environnements ultra-détaillés, multiples personnages, mini-jeux d'espionnage.
 ",[],[],<NA>,<NA>
139,A Tale of Two Kingdoms,70, 17.6,['PC'],['Adventure'],2007,8.4,$11.99,<NA>,<NA>,90 ,22,8,10,1,"		A Tale of Two Kingdoms is a graphical adventure in the style of the classic Sierra games. Set in the world of Celtic mythology and fairy tales, it features many sidequests and alternate endings. This release is a Deluxe Edition with a new interactive prologue, several graphic updates, and professional voice acting.Travel to the realm of Theylinn as the king calls on his old enemies for aid against a goblin invasion, get involved in intrigue and fairy trickery, and get stalked by an evil sorcerer who has its own agenda. Highly recommended for all fans of retro gaming.ATOTK was named Game of the Month by PC Zone UK, and has won four AGS Awards including Best Animation and Best Puzzles.""If ATOTK came out during the genre's heyday, we'd probably be waxing nostalgic about it today in the same breath as King's Quest."" - Games for Windows""A Tale of Two Kingdoms simply blew me away ... This game is a great achievement ... Final Grade: A"" - Just Adventure""An exceptionally good fairy tale Adventure which will be of enormous appeal to fans of the King's Quest series of Adventures. A lovely game."" - AdventurePoint						",<NA>,<NA>,<NA>,<NA>
140,A Valley Without Wind,68, 15.6,['PC'],"['Strategy', 'Adventure', 'Role-Playing']",2012,17.25,$14.99,<NA>,<NA>,62 ,191,6,10,1,"		A 2D sidescroller without a linear path. An action game with tactical combat and citybuilding. An adventure game that lets you free-roam a vast, procedurally-generated world. A Valley Without Wind defies genre stereotypes. Unlike other procedurally-generated games, you also get a logical progression in difficulty, plus helpful tips and checklists to guide your travels (should you need them).Choose for yourself how to prepare to face the vastly stronger Overlord. Complete a variety of missions to earn new spells, and/or roam the wilds to uncover secret missions and stashes of magical crafting loot. Customize your characters with unique combinations of enchants and spells that change how you move, jump, and fight. Or rescue people and bring them back to your settlement so that they can then be sent on dispatch missions; you don't have to carry the burden of your fledgling civilization alone! You choose how to play, and the world adapts around you.Key features:Travel alone or with friends across an ever-expanding world of dangerous creatures, powerful magic, high technology, and mysteries. You have choice. The world of Environ is a procedurally generated sandbox, and lets you go anywhere you see -- including right into the overlord's keep at any time. (Good luck with that.) Environ is endless. When you save one continent from an overlord, a larger and more complex continent appears. The game adapts to how you play: as you demonstrate your proficiency, monsters and missions upgrade accordingly. Killed 100 bats? Okay, time for... bats on fire! Crazy amounts of character customization. Combine a multitude of spells, enchants, and equipment to create specialized character builds. Play as a long line of brave adventurers. It's not a question of IF your character is going to die, but WHEN. Any character that dies is permanently lost, but you keep all your inventory, enchants, and general progress in the game. Become a community leader. Rescue NPCs for your settlement, construct buildings for them, and improve their skill and mood -- then send them on dispatch missions to help you in return! Be a clever problem-solver. Challenges have more than one solution, each with its own pros and cons. You get to figure things out rather than just jumping through a set of hoops. Difficulty levels give exactly the challenge you want, from casual to hardcore on platforming, combat, and citybuilding independently. All owners of Valley 1 also get the much-improved sequel absolutely free!  Valley 2 is out now, and features a different style of more-focused, non-sandbox play.  Both games are quite distinct from one another, but you don’t have to choose between them -- both are yours for the price of one! ",[],[],<NA>,<NA>
141,A Valley Without Wind 2,57,11.7,['PC'],"['Action', 'Adventure', 'Strategy']",2013,10.05,$14.99,<NA>,<NA>,47 ,109,6,10,1,"		A modern take on the 16-bit era, A Valley Without Wind 2 blends a variety of mechanics across multiple genres, seamlessly bringing together the best qualities of old-school platform-shooters and turn-based strategy games.  You choose how and where to explore via the world map, how to upgrade your character via mage classes, feats, and perks that you unlock, and how to battle the forces of evil every step of the way. Your character is a mage who has infiltrated the inner circle of the evil Demonaica, and you now share the power of immortality that he uses to terrorize the land. Using this power against him, it's time to lead an uprising and ultimately bring him and his henchmen back to mortality so that they can be dispatched.Gameplay alternates between two modes that complement each other: brief, tightly-designed platforming segments where your character customization and equipment can be tuned to meet the tactical needs of the current stage; and quick strategic turns on the world map where you order your troops to fight, scavenge, build, recruit, farm, and use special powers.  Demonaica and his armies pursue your forces directly on the world map, while his five henchmen have been sent to recapture you in the platforming segments.Your immortality came at great personal cost, but it makes you the one last hope of saving the world from darkness.Key Features:Platforming and Turn-Based Strategy Coupled Together: Flip back and forth between your own adventure, and the progress of the resistance you're in charge of.  Freely adjust difficulty levels for both to tailor the experience to your own personal playstyle.  Both sides of the game can be quite easy or incredibly hard.More Tactile Combat:The physics of movement and attacks have been completely redone from the first title, with more traditional gamepad and keyboard support. Spells have mass and can block each other, leading to many interesting tactical situations in the platforming segments. Vastly Improved Visuals:Fully redone artwork by Heavy Cat Studios, including 125 all-new monsters, 200 spells, and lots more.Focused Gameplay Arc:Unlike the endless sandbox-style first game, this complete re-imagining has a distinct beginning, middle, and end.Procedurally Generated Worlds:Each world is a unique challenge, leading to excellent replay value once you do beat the game!Co-Op Multiplayer:Bring along as many friends as you like on your journey, depending on your connection speed. 2-8 players recommended on most Internet connections; many more on LAN. See Just How Deep An Arcen-style Rabbit-Hole Goes:After dozens of hours you still haven't seen it all: 50 mage classes in 5 tiers, 200 spells, 125 enemies, 14 biomes, 100+ types of world map tiles, 64 character customization perks, 100ks of procedural equipment possibilities.Extra Challenges For Expert Players:String together flawless kills to earn ""concentration"" and become even stronger.  Beat the game on harder difficulties to earn rare achievements.Get The Original Game For Free!The original game was unique and experimental, and it comes included absolutely free when you buy the sequel. ",<NA>,[],<NA>,<NA>
142,A Vampyre Story,69,7.2,['PC'],['Adventure'],2008,7.2,$9.99,<NA>,<NA>,68 ,175,6,10,1,"jeu
Il était une fois...Au fin fond d'un lugubre château dans le tout aussi sinistre pays de Draxsylvanie, la jeune chanteuse d'opéra émérite Mona De Lafitte est maintenue prisonnière par son oppresseur, le vampire Baron Shrowdy Von Kiefer. Après avoir été transformée en vampire par le Baron Shrowdy, Mona ne rêve que d'une chose : quitter la Draxsylvanie et retourner à Paris afin de poursuivre sa carrière de chanteuse, et devenir un jour une grande cantatrice de l'Opéra de Paris.Lors d’une des escapades nocturnes du Baron Shrowdy, Mona tient enfin une occasion de s'enfuir. Avec l’aide de son seul ami et confident, une chauve-souris espiègle nommée Froderick, elle s'évade de sa prison et tente de retrouver le chemin de Paris. Au cours de son odyssée en Draxsylvanie, où elle rencontrera d'étranges habitants et fera face à des défis plus étranges encore, Mona devra non seulement apprendre à accepter sa condition de vampire, mais également à tirer profit de ses nouvelles aptitudes.L'aventure de “A Vampyre Story” a été conçue par Bill Tiller, connu des fans d'aventure pour son formidable travail sur quelques-uns des plus grands classiques du jeu d'aventure tels que Monkey Island, Indiana Jones ou encore The Dig.Le joueur utilise une interface point & click pour diriger Mona et Froderick à travers un monde riche en détails, comportant plus de 30 environnements magnifiques dessinés à la main, le tout utilisant une technologie temps réel de caméra 'Multiplane', poussant le joueur à examiner et à explorer toujours plus chaque décors. Durant son périple parsemé d'énigmes, Mona rencontrera plus de 20 personnages entièrement en 3D, du plus loufoque au plus terrifiant, durant environ 15 heures de jeu ponctuées d’énigmes et de puzzles souvent drôles et toujours passionnantes.Points forts:Un grand jeu d'aventure point & click réalisé par Bill Tiller.Plus de 30 lieux magnifiques dessinés à la main - utilisant une technologie temps réel de caméra 'Multiplane'.Plus de 25 personnages hauts en couleur - du plus étrange au plus insolite.Des compétences vampiriques qui auront une incidence sur les événements.Plus de 15 heures de fun et d’énigmes désopilantes. ",<NA>,<NA>,<NA>,<NA>
